{
  "success": true,
  "flash_tool": "jlink",
  "flash_mode": "cli",
  "flash_target": "App",
  "firmware_path": "release/Template.hex",
  "firmware_format": "hex",
  "firmware_source": "s7b",
  "firmware_size": 41586,
  "firmware_sha256": "432b33919a2443f73e42a47b53ad84119192476ab07b0a8b73affafa72693249",
  "device": "STM32F103ZE",
  "interface": "SWD",
  "target_address": 134217728,
  "verify": true,
  "verify_passed": true,
  "reset": true,
  "reset_done": true,
  "chip_erase": false,
  "duration_sec": 0.578,
  "tool_exit_code": 0,
  "timed_out": false,
  "retries": 0,
  "key_lines": [
    "J-Link connection not established yet but required for command.",
    "Connecting to J-Link via USB...O.K.",
    "Device \"STM32F103ZE\" selected.",
    "Connecting to target via SWD",
    "Downloading file [Template.hex]...",
    "J-Link: Flash download: Bank 0 @ 0x08000000: Skipped. Contents already match",
    "O.K.",
    "Loading binary file Template_verify.bin",
    "Verify successful.",
    "Reset delay: 0 ms",
    "Reset type NORMAL: Resets core & peripherals via SYSRESETREQ & VECTRESET bit.",
    "Reset: Halt core after reset via DEMCR.VC_CORERESET.",
    "Reset: Reset device via AIRCR.SYSRESETREQ.",
    "Script processing completed."
  ],
  "flash_log": "outputs/s9/flash.log",
  "release_manifest": "release/flash_info.json",
  "error": null,
  "generated_at": "2026-10-24T16:44:54"
}